{
  "episode_id": "DH1-S07-0001",
  "base_state_id": "INJECTION::INJ01_T_E_T_missing",
  "scenario_id": "S07_FAILCLOSED_INJECTION",
  "strategy_id": "NONE",
  "seed": 20260827,
  "accepted_urdf_sha256": "1bc2b7483cd8025d08ba6eadfd9e1f3b0477121714e7cf4ddc1794d9e471c164",
  "step_state_sha256": null,
  "collision_manifest_sha256": null,
  "frame_contract_sha256": "ef696dde3be403c59dce2c64fb828615c853567a1263195f6e73a00b021944ff",
  "unit_contract_sha256": "40d02a65c49b60f788352b73ce95ea98422fe9474004cee72daa35094b4041d5",
  "controller_config_sha256": null,
  "safe_config_sha256": "87b4d6bfc7b3ce67d82a2e99aac8893a6d6c6c5d093a069f16d7b368952da340",
  "plant_sha256": "d7a586ffad9b1074aafcbfe78d6046d9fd0e4038cba84f6195962bd0f65bf1be",
  "geometry_authority": "MISSING_CURRENT_STEP_0_OF_9",
  "dynamics_authority": "ACCEPTED_B601_URDF",
  "contact_authority": "NOT_EVALUATED",
  "T_E_T_status": "MISSING",
  "evidence_level": "PREBIND",
  "claim_ceiling": "CURRENT_SYSTEM_DIGITAL_HOST_CANDIDATE_PREBIND_ONLY",
  "binding_gate": "DH-G0",
  "terminal_decision": "ABORT",
  "label": "ABORT",
  "not_evaluated_reason": null,
  "failure_reason": null,
  "authority_snapshot_sha256": "f2bb7540cc10e9eff57603eb6a722a1408fc1e958cf4a8b728787b0023d6a73e"
}